{
  "input": "客户资料.xlsx",
  "output": "客户资料_普通表格.xlsx",
  "template": "样式模板.xlsx",
  "template_sheet": "Sheet1",
  "template_header_row": 1,
  "template_body_row": 2,
  "mode": "compact",
  "ranges": {"客户清单": "A7:S22", "补充清单": "A7:S15"},
  "acknowledge_crop": true,
  "layout": "readable",
  "overwrite": false
}
